{
 "table": "convoy-lanes",
 "sources": [
  "CNA1979:56.11",
  "CNA1979:56.14",
  "scan:p71",
  "CNA1979:55.17",
  "CNA1979:41.62",
  "CNA1979:42.52"
 ],
 "notes": [
  "Axis Naval Convoy Air Distance Chart (printed as 56.18, a case number the rules index does not list; the chart sits under the 37.42 Land Distance Chart on rules page jp2 71). Each lane is a fixed origin and destination (56.11-56.12); the Axis may not make new pairs. Its number is the Convoy Route column of the Simple Axis Naval Convoy Bombing Chart (axis-convoy-bombing.json, 32.66).",
  "Read twice: the archive.org scan (jp2 71) and the community converted rules PDF (scan:discord:CampaignNorthAfrica - converted.pdf:p72, rendered at 200 dpi): 0 of 41 cells differ. The djvu OCR text agrees on every value it kept.",
  "distances: hexes from planes in the Sicily, Italy or Crete box, any Malta hex, or the North African rally point to the lane. A plane from a North African air facility needs range for its facility to a rally point plus that rally point's figure (41.62, 42.52). null is the chart's dash (lane 1 from Crete).",
  "Opening: lanes 4 and 5 (from Greece) from the second Game-Turn of May 1941, Game-Turn 32 (56.14; calendar.json). Lane 1 ends at Bizerta in the Tunisia box, which cannot be used before Game-Turn 35 (June I 1941) and then only once the Axis rolls 12 on two dice in a Game-Turn (55.17). So in 1940 and early 1941 only lanes 2, 3 and 6 are open, which is what Graziani's Offensive repeats (60.37).",
  "A convoy whose destination port the Commonwealth captures before it sails is cancelled (56.15); a lane has no tonnage limit of its own (56.17)."
 ],
 "rally_points": [
  {
   "id": "sicily",
   "kind": "box"
  },
  {
   "id": "italy",
   "kind": "box"
  },
  {
   "id": "crete",
   "kind": "box"
  },
  {
   "id": "malta",
   "kind": "malta"
  },
  {
   "id": "benghazi",
   "kind": "place",
   "hex": "A4827"
  },
  {
   "id": "derna",
   "kind": "place",
   "hex": "B5925"
  },
  {
   "id": "tobruk",
   "kind": "place",
   "hex": "C4807"
  }
 ],
 "lanes": [
  {
   "lane": 1,
   "name": "West Sicily to Bizerta",
   "origin": "west-sicily",
   "destination": {
    "port": "bizerta",
    "box": "tunisia"
   },
   "first_game_turn": 35,
   "activation_roll": true,
   "distances": {
    "sicily": 20,
    "italy": 56,
    "crete": null,
    "malta": 42,
    "benghazi": 126,
    "derna": 145,
    "tobruk": 165
   },
   "sources": [
    "CNA1979:56.11",
    "CNA1979:56.14",
    "scan:p71",
    "CNA1979:55.17"
   ]
  },
  {
   "lane": 2,
   "name": "West Sicily to Tripoli",
   "origin": "west-sicily",
   "destination": {
    "port": "tripoli",
    "box": "tripoli"
   },
   "first_game_turn": null,
   "activation_roll": false,
   "distances": {
    "sicily": 45,
    "italy": 82,
    "crete": 134,
    "malta": 35,
    "benghazi": 100,
    "derna": 135,
    "tobruk": 160
   },
   "sources": [
    "CNA1979:56.11",
    "CNA1979:56.14",
    "scan:p71"
   ]
  },
  {
   "lane": 3,
   "name": "Italy to Benghazi",
   "origin": "italy",
   "destination": {
    "port": "benghazi",
    "hex": "A4827"
   },
   "first_game_turn": null,
   "activation_roll": false,
   "distances": {
    "sicily": 41,
    "italy": 79,
    "crete": 80,
    "malta": 50,
    "benghazi": 51,
    "derna": 57,
    "tobruk": 80
   },
   "sources": [
    "CNA1979:56.11",
    "CNA1979:56.14",
    "scan:p71"
   ]
  },
  {
   "lane": 4,
   "name": "Greece to Benghazi",
   "origin": "greece",
   "destination": {
    "port": "benghazi",
    "hex": "A4827"
   },
   "first_game_turn": 32,
   "activation_roll": false,
   "distances": {
    "sicily": 83,
    "italy": 117,
    "crete": 38,
    "malta": 80,
    "benghazi": 27,
    "derna": 22,
    "tobruk": 42
   },
   "sources": [
    "CNA1979:56.11",
    "CNA1979:56.14",
    "scan:p71"
   ]
  },
  {
   "lane": 5,
   "name": "Greece to Tobruk",
   "origin": "greece",
   "destination": {
    "port": "tobruk",
    "hex": "C4807"
   },
   "first_game_turn": 32,
   "activation_roll": false,
   "distances": {
    "sicily": 96,
    "italy": 137,
    "crete": 28,
    "malta": 125,
    "benghazi": 44,
    "derna": 18,
    "tobruk": 26
   },
   "sources": [
    "CNA1979:56.11",
    "CNA1979:56.14",
    "scan:p71"
   ]
  },
  {
   "lane": 6,
   "name": "Italy to Tobruk",
   "origin": "italy",
   "destination": {
    "port": "tobruk",
    "hex": "C4807"
   },
   "first_game_turn": null,
   "activation_roll": false,
   "distances": {
    "sicily": 57,
    "italy": 101,
    "crete": 62,
    "malta": 70,
    "benghazi": 39,
    "derna": 38,
    "tobruk": 60
   },
   "sources": [
    "CNA1979:56.11",
    "CNA1979:56.14",
    "scan:p71"
   ]
  }
 ]
}
